{
  "$schema": "https://json-schema.org/draft/2020-12/schema",
  "$id": "https://aka.ms/sslz/schemas/postgresql-migration-plan-input.schema.json",
  "title": "SSLZ PostgreSQL migration planning input",
  "type": "object",
  "additionalProperties": false,
  "required": [
    "schemaVersion",
    "planId",
    "planningAt",
    "maxAssessmentAgeHours",
    "sourceAssessment",
    "target",
    "scope",
    "requirements",
    "validationPlan",
    "rollbackPlan",
    "decisions"
  ],
  "properties": {
    "schemaVersion": { "const": "1.0.0" },
    "planId": { "$ref": "#/$defs/reference" },
    "planningAt": { "type": "string", "format": "date-time" },
    "maxAssessmentAgeHours": { "type": "integer", "minimum": 1, "maximum": 168 },
    "sourceAssessment": {
      "$ref": "postgresql-source-assessment.schema.json"
    },
    "target": {
      "type": "object",
      "additionalProperties": false,
      "required": ["regionalPlanningInput", "migrationEvidence"],
      "properties": {
        "regionalPlanningInput": {
          "$ref": "postgresql-regional-plan-input.schema.json"
        },
        "migrationEvidence": {
          "type": "object",
          "additionalProperties": false,
          "required": [
            "schemaVersion",
            "observedAt",
            "expiresAt",
            "reference",
            "region",
            "engine",
            "extensions",
            "features",
            "supportedEncodings",
            "supportedCollations",
            "capacity",
            "availability",
            "network",
            "identity",
            "migrationTools"
          ],
          "properties": {
            "schemaVersion": { "const": "1.0.0" },
            "observedAt": { "type": "string", "format": "date-time" },
            "expiresAt": { "type": "string", "format": "date-time" },
            "reference": { "$ref": "#/$defs/reference" },
            "region": { "$ref": "#/$defs/region" },
            "engine": { "$ref": "#/$defs/engine" },
            "extensions": {
              "type": "array",
              "uniqueItems": true,
              "items": {
                "type": "object",
                "additionalProperties": false,
                "required": ["name", "versions"],
                "properties": {
                  "name": { "$ref": "#/$defs/value" },
                  "versions": {
                    "type": "array",
                    "minItems": 1,
                    "uniqueItems": true,
                    "items": { "$ref": "#/$defs/version" }
                  }
                }
              }
            },
            "features": {
              "type": "object",
              "additionalProperties": false,
              "required": [
                "largeObjects",
                "rowLevelSecurity",
                "generatedColumns",
                "logicalReplication"
              ],
              "properties": {
                "largeObjects": { "type": "boolean" },
                "rowLevelSecurity": { "type": "boolean" },
                "generatedColumns": { "type": "boolean" },
                "logicalReplication": { "type": "boolean" }
              }
            },
            "supportedEncodings": {
              "type": "array",
              "minItems": 1,
              "uniqueItems": true,
              "items": { "$ref": "#/$defs/value" }
            },
            "supportedCollations": {
              "type": "array",
              "minItems": 1,
              "uniqueItems": true,
              "items": { "$ref": "#/$defs/locale" }
            },
            "capacity": {
              "type": "object",
              "additionalProperties": false,
              "required": [
                "maxStorageGiB",
                "provisionedStorageGiB",
                "maxIops",
                "maxConnections",
                "initialLoadMiBPerSecond"
              ],
              "properties": {
                "maxStorageGiB": { "type": "number", "minimum": 0 },
                "provisionedStorageGiB": { "type": "number", "minimum": 0 },
                "maxIops": { "type": "number", "minimum": 0 },
                "maxConnections": { "type": "integer", "minimum": 1 },
                "initialLoadMiBPerSecond": {
                  "type": "number",
                  "exclusiveMinimum": 0
                }
              }
            },
            "availability": {
              "type": "object",
              "additionalProperties": false,
              "required": ["highAvailability", "zones"],
              "properties": {
                "highAvailability": { "enum": ["same-zone", "zone-redundant"] },
                "zones": {
                  "type": "array",
                  "minItems": 1,
                  "uniqueItems": true,
                  "items": { "type": "string", "pattern": "^[1-3]$" }
                }
              }
            },
            "network": {
              "type": "object",
              "additionalProperties": false,
              "required": ["privateConnectivity", "privateDns", "connectivityReference"],
              "properties": {
                "privateConnectivity": { "enum": ["ready", "planned", "missing", "unknown"] },
                "privateDns": { "enum": ["ready", "planned", "missing", "unknown"] },
                "connectivityReference": { "$ref": "#/$defs/reference" }
              }
            },
            "identity": {
              "type": "object",
              "additionalProperties": false,
              "required": ["authenticationModes", "configurationReference"],
              "properties": {
                "authenticationModes": {
                  "type": "array",
                  "minItems": 1,
                  "uniqueItems": true,
                  "items": { "enum": ["postgresql-native", "entra-id", "certificate"] }
                },
                "configurationReference": { "$ref": "#/$defs/reference" }
              }
            },
            "migrationTools": {
              "type": "array",
              "minItems": 1,
              "items": {
                "type": "object",
                "additionalProperties": false,
                "required": ["name", "available", "supportsOnline"],
                "properties": {
                  "name": { "enum": ["pg-dump-restore", "azure-dms", "native-logical-replication"] },
                  "available": { "type": "boolean" },
                  "supportsOnline": { "type": "boolean" }
                }
              }
            }
          }
        }
      }
    },
    "scope": {
      "type": "object",
      "additionalProperties": false,
      "required": [
        "databaseReferences",
        "includeLargeObjects",
        "includeRoles",
        "includeOwnership",
        "includeRowLevelSecurity",
        "includeReplicationObjects"
      ],
      "properties": {
        "databaseReferences": {
          "type": "array",
          "minItems": 1,
          "uniqueItems": true,
          "items": { "$ref": "#/$defs/reference" }
        },
        "includeLargeObjects": { "type": "boolean" },
        "includeRoles": { "type": "boolean" },
        "includeOwnership": { "type": "boolean" },
        "includeRowLevelSecurity": { "type": "boolean" },
        "includeReplicationObjects": { "type": "boolean" }
      }
    },
    "requirements": {
      "type": "object",
      "additionalProperties": false,
      "required": [
        "strategy",
        "minimumStorageHeadroomPercent",
        "minimumIopsHeadroomPercent",
        "minimumConnectionHeadroomPercent",
        "requirePrivateConnectivity"
      ],
      "properties": {
        "strategy": {
          "enum": [
            "auto",
            "offline-dump-restore",
            "online-logical-replication"
          ]
        },
        "minimumStorageHeadroomPercent": { "type": "number", "minimum": 0 },
        "minimumIopsHeadroomPercent": { "type": "number", "minimum": 0 },
        "minimumConnectionHeadroomPercent": { "type": "number", "minimum": 0 },
        "requirePrivateConnectivity": { "type": "boolean" }
      }
    },
    "validationPlan": {
      "type": "object",
      "additionalProperties": false,
      "required": [
        "ownerReference",
        "queryReferences",
        "checksums",
        "rowCounts",
        "objectCounts",
        "applicationSmokeTestReferences"
      ],
      "properties": {
        "ownerReference": { "$ref": "#/$defs/reference" },
        "queryReferences": { "$ref": "#/$defs/nonEmptyReferences" },
        "checksums": { "type": "boolean" },
        "rowCounts": { "type": "boolean" },
        "objectCounts": { "type": "boolean" },
        "applicationSmokeTestReferences": {
          "$ref": "#/$defs/nonEmptyReferences"
        }
      }
    },
    "rollbackPlan": {
      "oneOf": [
        { "type": "null" },
        {
          "type": "object",
          "additionalProperties": false,
          "required": [
            "ownerReference",
            "rollbackWindowMinutes",
            "conditions",
            "failbackSourceOfTruth",
            "stepReferences"
          ],
          "properties": {
            "ownerReference": { "$ref": "#/$defs/reference" },
            "rollbackWindowMinutes": { "type": "integer", "minimum": 1 },
            "conditions": { "$ref": "#/$defs/nonEmptyReferences" },
            "failbackSourceOfTruth": { "const": "source" },
            "stepReferences": { "$ref": "#/$defs/nonEmptyReferences" }
          }
        }
      ]
    },
    "decisions": {
      "type": "object",
      "additionalProperties": false,
      "required": [
        "largeObjectHandling",
        "roleMappingReference",
        "authenticationMappingReference",
        "rowLevelSecurityValidationReference",
        "collationMappingReference",
        "dnsCutoverReference",
        "applicationConnectionChangeReference",
        "secretRotationReferences"
      ],
      "properties": {
        "largeObjectHandling": {
          "enum": ["not-required", "offline-window", "supported-online", "unresolved"]
        },
        "roleMappingReference": {
          "oneOf": [{ "$ref": "#/$defs/reference" }, { "type": "null" }]
        },
        "authenticationMappingReference": {
          "oneOf": [{ "$ref": "#/$defs/reference" }, { "type": "null" }]
        },
        "rowLevelSecurityValidationReference": {
          "oneOf": [{ "$ref": "#/$defs/reference" }, { "type": "null" }]
        },
        "collationMappingReference": {
          "oneOf": [{ "$ref": "#/$defs/reference" }, { "type": "null" }]
        },
        "dnsCutoverReference": { "$ref": "#/$defs/reference" },
        "applicationConnectionChangeReference": { "$ref": "#/$defs/reference" },
        "secretRotationReferences": { "$ref": "#/$defs/nonEmptyReferences" }
      }
    }
  },
  "$defs": {
    "reference": {
      "type": "string",
      "pattern": "^[a-z0-9][a-z0-9._:/-]{2,159}$"
    },
    "region": {
      "type": "string",
      "pattern": "^[a-z][a-z0-9]{1,31}$"
    },
    "value": {
      "type": "string",
      "pattern": "^[A-Za-z0-9][A-Za-z0-9._-]{0,63}$"
    },
    "version": {
      "type": "string",
      "pattern": "^[0-9]+(?:\\.[0-9A-Za-z-]+){0,3}$"
    },
    "locale": {
      "type": "string",
      "pattern": "^[A-Za-z0-9][A-Za-z0-9._@-]{0,63}$"
    },
    "nonEmptyReferences": {
      "type": "array",
      "minItems": 1,
      "uniqueItems": true,
      "items": { "$ref": "#/$defs/reference" }
    },
    "engine": {
      "type": "object",
      "additionalProperties": false,
      "required": ["family", "major", "minor"],
      "properties": {
        "family": { "const": "postgresql" },
        "major": { "type": "integer", "minimum": 11, "maximum": 99 },
        "minor": { "type": "integer", "minimum": 0, "maximum": 99 }
      }
    }
  }
}
